{
  "schema_version": 1,
  "resolved_at": "2026-08-27T14:13:00Z",
  "requirements": {
    "schema_version": 1,
    "objective": "Parse the provided log once",
    "required_capabilities": ["log-parsing"],
    "optional_capabilities": [],
    "available_tools": [],
    "context": { "read_paths": ["provided-input"], "write_paths": [] },
    "permission_ceiling": { "autonomous": [], "conditional": [] },
    "constraints": ["Do not persist project state"]
  },
  "registry_versions": [{ "registry_id": "xiaotao-builtins", "version": "sha256:example" }],
  "resolution": "generated",
  "selected_workers": [{ "id": "one-off-log-parser", "ephemeral": true }],
  "rationale": "No reusable Worker covers log parsing, and the one-off result needs no persistence."
}
